{
  "schema_version": "fabricctl.pairing-request/v1",
  "bundle_digest": "sha256:aaaaaaaaaaaaaaaaaaaaaaaaaaaaaaaaaaaaaaaaaaaaaaaaaaaaaaaaaaaaaaaa",
  "target_digest": "sha256:bbbbbbbbbbbbbbbbbbbbbbbbbbbbbbbbbbbbbbbbbbbbbbbbbbbbbbbbbbbbbbbb",
  "effective_digest": "sha256:cccccccccccccccccccccccccccccccccccccccccccccccccccccccccccccccc",
  "target": {
    "backend": "kubernetes-helm",
    "context": "regulated-production",
    "cluster_uid": "cluster-01",
    "namespace": "fabric-system",
    "release_name": "fabric"
  },
  "workload": {
    "type": "kubernetes-service-account",
    "reference": "system:serviceaccount:fabric-system:fabric-site"
  }
}
